Country,Description
CANADA,Canada is renowned for its vast and diverse landscapes, spanning from the stunning Rocky Mountains to the serene lakes of the Canadian Shield.
CHINA,China, a nation steeped in history and tradition, captivates the world with its iconic landmarks such as the Great Wall and the Forbidden City.
FINLAND,With a harmonious blend of picturesque landscapes, including forests and lakes, and a world-class education system, Finland stands out as a model of environmental sustainability and academic excellence.
GERMANY,Germany, a powerhouse in Europe, is celebrated for its engineering prowess, exemplified by precision in automotive and technological innovation. Rich in history and cultural heritage, Germany also stands as a beacon for its classical music.
IRELAND,Ireland, known as the "Emerald Isle," captivates with its lush landscapes, charming countryside, and a cultural tapestry woven with folklore and literary heritage.
ITALY,Renowned for its exquisite cuisine, timeless art, and romantic landscapes, Italy stands as a global symbol of cultural richness and Mediterranean allure.
JAPAN,Renowned for its disciplined work ethic, cultural richness, and culinary artistry, Japan stands as a dynamic global influence, seamlessly blending ancient customs with innovative advancements.
MALAYSIA,Malaysia entices with its diverse cultural tapestry, featuring a harmonious blend of Malay, Chinese, Indian, and indigenous influences.
RUSSIA,Russia, spanning two continents, is known for its vast landscapes, historic treasures such as the Kremlin, and a rich cultural legacy in literature, music, and ballet.
SINGAPORE,Famed for its efficient governance, multiculturalism, and culinary delights in hawker centers, Singapore is a shining example of urban innovation and economic success in Southeast Asia.
SOUTH KOREA,Boasting a captivating contrast of ancient palaces and futuristic cities, South Korea stands as a cultural and economic powerhouse in East Asia.
SPAIN,Spain beckons with its vibrant fiestas, historic landmarks like the Sagrada Familia, and diverse landscapes from the sun-soaked beaches of Costa del Sol to the charming streets of Barcelona.
UNITED KINGDOM,The United Kingdom, steeped in history and cultural influence, is celebrated for its iconic landmarks including Big Ben, Buckingham Palace, and the historic charm of cities like London and Edinburgh.
USA,The USA, a vast and diverse nation, is known for its economic prowess, cultural influence through Hollywood, and iconic landmarks like the Statue of Liberty.
